PMID,Title,Authors,Citation,First Author,Journal/Book,Publication Year,Create Date,PMCID,NIHMS ID,DOI
"21735216","Fatigue after short (100-m), medium (200-m) and long (400-m) treadmill sprints","Tomazin K, Morin JB, Strojnik V, Podpecan A, Millet GY.","Eur J Appl Physiol. 2012 Mar;112(3):1027-36. doi: 10.1007/s00421-011-2058-1. Epub 2011 Jul 7.","Tomazin K","Eur J Appl Physiol","2012","2011/07/08","","","10.1007/s00421-011-2058-1"
"21674405","Decreased central fatigue in multiple sclerosis patients after 8 weeks of surface functional electrical stimulation","Chang YJ, Hsu MJ, Chen SM, Lin CH, Wong AM.","J Rehabil Res Dev. 2011;48(5):555-64. doi: 10.1682/jrrd.2010.03.0038.","Chang YJ","J Rehabil Res Dev","2011","2011/06/16","","","10.1682/jrrd.2010.03.0038"
"22488187","Electrode type and placement configuration for quadriceps activation evaluation","Pietrosimone BG, Selkow NM, Ingersoll CD, Hart JM, Saliba SA.","J Athl Train. 2011 Nov-Dec;46(6):621-8. doi: 10.4085/1062-6050-46.6.621.","Pietrosimone BG","J Athl Train","2011","2012/04/11","PMC3418939","","10.4085/1062-6050-46.6.621"
"20829493","Power loss is greater in old men than young men during fast plantar flexion contractions","Dalton BH, Power GA, Vandervoort AA, Rice CL.","J Appl Physiol (1985). 2010 Nov;109(5):1441-7. doi: 10.1152/japplphysiol.00335.2010. Epub 2010 Sep 9.","Dalton BH","J Appl Physiol (1985)","2010","2010/09/11","","","10.1152/japplphysiol.00335.2010"
"19913663","Transcranial magnetic stimulation in Gilles de la Tourette syndrome","Orth M.","J Psychosom Res. 2009 Dec;67(6):591-8. doi: 10.1016/j.jpsychores.2009.07.014.","Orth M","J Psychosom Res","2009","2009/11/17","","","10.1016/j.jpsychores.2009.07.014"
"17550408","Muscle fatigue resistance during stimulated contractions is reduced in young male smokers","Morse CI, Wüst RC, Jones DA, de Haan A, Degens H.","Acta Physiol (Oxf). 2007 Oct;191(2):123-9. doi: 10.1111/j.1748-1716.2007.01721.x. Epub 2007 Jun 5.","Morse CI","Acta Physiol (Oxf)","2007","2007/06/07","","","10.1111/j.1748-1716.2007.01721.x"
"16790067","Robot-assisted reaching exercise promotes arm movement recovery in chronic hemiparetic stroke: a randomized controlled pilot study","Kahn LE, Zygman ML, Rymer WZ, Reinkensmeyer DJ.","J Neuroeng Rehabil. 2006 Jun 21;3:12. doi: 10.1186/1743-0003-3-12.","Kahn LE","J Neuroeng Rehabil","2006","2006/06/23","PMC1550245","","10.1186/1743-0003-3-12"
"15843959","Static balance improvement in elderly after dorsiflexors electrostimulation training","Amiridis I, Arabatzi F, Violaris P, Stavropoulos E, Hatzitaki V.","Eur J Appl Physiol. 2005 Jul;94(4):424-33. doi: 10.1007/s00421-005-1326-3. Epub 2005 Apr 21.","Amiridis I","Eur J Appl Physiol","2005","2005/04/22","","","10.1007/s00421-005-1326-3"
"33300756","Dynamic Changes of Performance Fatigability and Muscular O2 Saturation in a 4-km Cycling Time Trial","Azevedo RA, Milioni F, Murias JM, Bertuzzi R, Millet GY.","Med Sci Sports Exerc. 2021 Mar 1;53(3):613-623. doi: 10.1249/MSS.0000000000002499.","Azevedo RA","Med Sci Sports Exerc","2021","2020/12/10","","","10.1249/MSS.0000000000002499"
"32718211","Residual Innervation of the Pelvic Floor Muscles in People with Motor-Complete Spinal Cord Injury","Williams AMM, Eginyan G, Deegan E, Chow M, Carpenter MG, Lam T.","J Neurotrauma. 2020 Nov 1;37(21):2320-2331. doi: 10.1089/neu.2019.6908. Epub 2020 Aug 21.","Williams AMM","J Neurotrauma","2020","2020/07/29","","","10.1089/neu.2019.6908"
"32182904","Central and Peripheral Neuromuscular Adaptations to Ageing","Borzuola R, Giombini A, Torre G, Campi S, Albo E, Bravi M, Borrione P, Fossati C, Macaluso A.","J Clin Med. 2020 Mar 9;9(3):741. doi: 10.3390/jcm9030741.","Borzuola R","J Clin Med","2020","2020/03/19","PMC7141192","","10.3390/jcm9030741"
"31082324","Cycling performed on an innovative ergometer at different intensities-durations in men: neuromuscular fatigue and recovery kinetics","Krüger RL, Aboodarda SJ, Jaimes LM, Samozino P, Millet GY.","Appl Physiol Nutr Metab. 2019 Dec;44(12):1320-1328. doi: 10.1139/apnm-2018-0858. Epub 2019 May 13.","Krüger RL","Appl Physiol Nutr Metab","2019","2019/05/15","","","10.1139/apnm-2018-0858"
"31068827","Dietary Nitrate Supplementation Improves Exercise Tolerance by Reducing Muscle Fatigue and Perceptual Responses","Husmann F, Bruhn S, Mittlmeier T, Zschorlich V, Behrens M.","Front Physiol. 2019 Apr 24;10:404. doi: 10.3389/fphys.2019.00404. eCollection 2019.","Husmann F","Front Physiol","2019","2019/05/10","PMC6491676","","10.3389/fphys.2019.00404"
"30908368","Factors Underlying Bench Press Performance in Elite Competitive Powerlifters","Reya M, Škarabot J, Cvetičanin B, Šarabon N.","J Strength Cond Res. 2021 Aug 1;35(8):2179-2186. doi: 10.1519/JSC.0000000000003097.","Reya M","J Strength Cond Res","2021","2019/03/26","","","10.1519/JSC.0000000000003097"
"30842931","Correction of animation deformity with subpectoral to prepectoral implant exchange","Lentz R, Alcon A, Sbitany H.","Gland Surg. 2019 Feb;8(1):75-81. doi: 10.21037/gs.2018.09.05.","Lentz R","Gland Surg","2019","2019/03/08","PMC6378248","","10.21037/gs.2018.09.05"
"30734321","Influence of cognitive load on the dynamics of neurophysiological adjustments during fatiguing exercise","Chatain C, Radel R, Vercruyssen F, Rabahi T, Vallier JM, Bernard T, Gruet M.","Psychophysiology. 2019 Jun;56(6):e13343. doi: 10.1111/psyp.13343. Epub 2019 Feb 7.","Chatain C","Psychophysiology","2019","2019/02/09","","","10.1111/psyp.13343"
"30530332","Voluntary Control of Residual Antagonistic Muscles in Transtibial Amputees: Reciprocal Activation, Coactivation, and Implications for Direct Neural Control of Powered Lower Limb Prostheses","Huang S, Huang H.","IEEE Trans Neural Syst Rehabil Eng. 2019 Jan;27(1):85-95. doi: 10.1109/TNSRE.2018.2885641. Epub 2018 Dec 7.","Huang S","IEEE Trans Neural Syst Rehabil Eng","2019","2018/12/12","","","10.1109/TNSRE.2018.2885641"
"30484343","Motor performance is preserved in healthy aged adults following severe whole-body hyperthermia","Brazaitis M, Paulauskas H, Eimantas N, Daniuseviciute L, Volungevicius G, Skurvydas A.","Int J Hyperthermia. 2019;36(1):65-74. doi: 10.1080/02656736.2018.1533650. Epub 2018 Nov 1.","Brazaitis M","Int J Hyperthermia","2019","2018/11/29","","","10.1080/02656736.2018.1533650"
"30016203","Corticospinal changes induced by fatiguing eccentric versus concentric exercise","Garnier YM, Paizis C, Lepers R.","Eur J Sport Sci. 2019 Mar;19(2):166-176. doi: 10.1080/17461391.2018.1497090. Epub 2018 Jul 17.","Garnier YM","Eur J Sport Sci","2019","2018/07/18","","","10.1080/17461391.2018.1497090"
"29428788","A pilot study of a novel therapeutic approach to obesity: CNS modification by N.I.R. H.E.G. neurofeedback","Percik R, Cina J, Even B, Gitler A, Geva D, Seluk L, Livny A.","Clin Nutr. 2019 Feb;38(1):258-263. doi: 10.1016/j.clnu.2018.01.023. Epub 2018 Feb 15.","Percik R","Clin Nutr","2019","2018/02/12","","","10.1016/j.clnu.2018.01.023"
"29117071","Deception Improves Time Trial Performance in Well-trained Cyclists without Augmented Fatigue","Ansdell P, Thomas K, Howatson G, Amann M, Goodall S.","Med Sci Sports Exerc. 2018 Apr;50(4):809-816. doi: 10.1249/MSS.0000000000001483.","Ansdell P","Med Sci Sports Exerc","2018","2017/11/09","PMC5856589","NIHMS917427","10.1249/MSS.0000000000001483"
"24326780","Quadriceps corticomotor excitability following an experimental knee joint effusion","Lepley AS, Bahhur NO, Murray AM, Pietrosimone BG.","Knee Surg Sports Traumatol Arthrosc. 2015 Apr;23(4):1010-7. doi: 10.1007/s00167-013-2816-1. Epub 2013 Dec 11.","Lepley AS","Knee Surg Sports Traumatol Arthrosc","2015","2013/12/12","","","10.1007/s00167-013-2816-1"
"22137196","Post-match changes in neuromuscular function and the relationship to match demands in amateur rugby league matches","Duffield R, Murphy A, Snape A, Minett GM, Skein M.","J Sci Med Sport. 2012 May;15(3):238-43. doi: 10.1016/j.jsams.2011.10.003. Epub 2011 Dec 3.","Duffield R","J Sci Med Sport","2012","2011/12/06","","","10.1016/j.jsams.2011.10.003"
"20221772","Heat acclimation does not reduce the impact of hyperthermia on central fatigue","Brazaitis M, Skurvydas A.","Eur J Appl Physiol. 2010 Jul;109(4):771-8. doi: 10.1007/s00421-010-1429-3. Epub 2010 Mar 11.","Brazaitis M","Eur J Appl Physiol","2010","2010/03/12","","","10.1007/s00421-010-1429-3"
"20157419","Carbohydrate vs protein supplementation for recovery of neuromuscular function following prolonged load carriage","Blacker SD, Williams NC, Fallowfield JL, Bilzon JLj, Willems ME.","J Int Soc Sports Nutr. 2010 Jan 12;7:2. doi: 10.1186/1550-2783-7-2.","Blacker SD","J Int Soc Sports Nutr","2010","2010/02/17","PMC2821364","","10.1186/1550-2783-7-2"
"19777253","Leg dominancy in relation to fast isometric torque production and squat jump height","de Ruiter CJ, de Korte A, Schreven S, de Haan A.","Eur J Appl Physiol. 2010 Jan;108(2):247-55. doi: 10.1007/s00421-009-1209-0. Epub 2009 Sep 24.","de Ruiter CJ","Eur J Appl Physiol","2010","2009/09/25","PMC2799630","","10.1007/s00421-009-1209-0"
"19770195","Modulation of interhemispheric inhibition by volitional motor activity: an ipsilateral silent period study","Giovannelli F, Borgheresi A, Balestrieri F, Zaccara G, Viggiano MP, Cincotta M, Ziemann U.","J Physiol. 2009 Nov 15;587(Pt 22):5393-410. doi: 10.1113/jphysiol.2009.175885. Epub 2009 Sep 21.","Giovannelli F","J Physiol","2009","2009/09/23","PMC2793872","","10.1113/jphysiol.2009.175885"
"16794023","Training adaptations in the behavior of human motor units","Duchateau J, Semmler JG, Enoka RM.","J Appl Physiol (1985). 2006 Dec;101(6):1766-75. doi: 10.1152/japplphysiol.00543.2006. Epub 2006 Jun 22.","Duchateau J","J Appl Physiol (1985)","2006","2006/06/24","","","10.1152/japplphysiol.00543.2006"
"15180971","Initial phase of maximal voluntary and electrically stimulated knee extension torque development at different knee angles","de Ruiter CJ, Kooistra RD, Paalman MI, de Haan A.","J Appl Physiol (1985). 2004 Nov;97(5):1693-701. doi: 10.1152/japplphysiol.00230.2004. Epub 2004 Jun 4.","de Ruiter CJ","J Appl Physiol (1985)","2004","2004/06/08","","","10.1152/japplphysiol.00230.2004"
"12948791","Low-frequency rTMS over lateral premotor cortex induces lasting changes in regional activation and functional coupling of cortical motor areas","Chen WH, Mima T, Siebner HR, Oga T, Hara H, Satow T, Begum T, Nagamine T, Shibasaki H.","Clin Neurophysiol. 2003 Sep;114(9):1628-37. doi: 10.1016/s1388-2457(03)00063-4.","Chen WH","Clin Neurophysiol","2003","2003/09/02","","","10.1016/s1388-2457(03)00063-4"
"12544644","Reduced neural drive in bilateral exertions: a performance-limiting factor?","Van Dieën JH, Ogita F, De Haan A.","Med Sci Sports Exerc. 2003 Jan;35(1):111-8. doi: 10.1097/00005768-200301000-00018.","Van Dieën JH","Med Sci Sports Exerc","2003","2003/01/25","","","10.1097/00005768-200301000-00018"
"25367024","Post-stroke fatigue: a deficit in corticomotor excitability?","Kuppuswamy A, Clark EV, Turner IF, Rothwell JC, Ward NS.","Brain. 2015 Jan;138(Pt 1):136-48. doi: 10.1093/brain/awu306. Epub 2014 Nov 2.","Kuppuswamy A","Brain","2015","2014/11/05","PMC4441078","","10.1093/brain/awu306"
"31723215","Sex difference in fatigability of knee extensor muscles during sustained low-level contractions","Akagi R, Sato S, Yoshihara K, Ishimatsu H, Ema R.","Sci Rep. 2019 Nov 13;9(1):16718. doi: 10.1038/s41598-019-53375-z.","Akagi R","Sci Rep","2019","2019/11/15","PMC6853909","","10.1038/s41598-019-53375-z"
"31362579","Stochastic ordering of simulated rugby match activity produces reliable movements and associated measures of subjective task load, cognitive and neuromuscular function","Mullen T, Twist C, Highton J.","J Sports Sci. 2019 Nov;37(21):2506-2512. doi: 10.1080/02640414.2019.1646071. Epub 2019 Jul 31.","Mullen T","J Sports Sci","2019","2019/08/01","","","10.1080/02640414.2019.1646071"
"30095744","Supraspinal Fatigue and Neural-evoked Responses in Lowlanders and Sherpa at 5050 m","Ruggiero L, McNeil CJ.","Med Sci Sports Exerc. 2019 Jan;51(1):183-192. doi: 10.1249/MSS.0000000000001748.","Ruggiero L","Med Sci Sports Exerc","2019","2018/08/11","","","10.1249/MSS.0000000000001748"
"29023563","Influence of platinum harmonized textile on neuromuscular, systemic and subjective recovery","Zinke F, Bakenecker P, Hahn D.","PLoS One. 2017 Oct 12;12(10):e0186162. doi: 10.1371/journal.pone.0186162. eCollection 2017.","Zinke F","PLoS One","2017","2017/10/13","PMC5638408","","10.1371/journal.pone.0186162"
"28708702","Exercise-induced Fatigue in Severe Hypoxia after an Intermittent Hypoxic Protocol","Twomey R, Wrightson J, Fletcher H, Avraam S, Ross E, Dekerle J.","Med Sci Sports Exerc. 2017 Dec;49(12):2422-2432. doi: 10.1249/MSS.0000000000001371.","Twomey R","Med Sci Sports Exerc","2017","2017/07/15","","","10.1249/MSS.0000000000001371"
"28673118","Muscle recruitment patterns of the subscapularis, serratus anterior and other shoulder girdle muscles during isokinetic internal and external rotations","Gaudet S, Tremblay J, Begon M.","J Sports Sci. 2018 May;36(9):985-993. doi: 10.1080/02640414.2017.1347697. Epub 2017 Jul 4.","Gaudet S","J Sports Sci","2018","2017/07/05","","","10.1080/02640414.2017.1347697"
"27182973","Normative Values for Intertrial Variability of Motor Responses to Nerve Root and Transcranial Stimulation: A Condition for Follow-Up Studies in Individual Subjects","Troni W, Melillo F, Bertolotto A, Malucchi S, Capobianco M, Sperli F, Di Sapio A.","PLoS One. 2016 May 16;11(5):e0155268. doi: 10.1371/journal.pone.0155268. eCollection 2016.","Troni W","PLoS One","2016","2016/05/17","PMC4868303","","10.1371/journal.pone.0155268"
"26982500","Set Configuration in Resistance Exercise: Muscle Fatigue and Cardiovascular Effects","Río-Rodríguez D, Iglesias-Soler E, Fernández Del Olmo M.","PLoS One. 2016 Mar 16;11(3):e0151163. doi: 10.1371/journal.pone.0151163. eCollection 2016.","Río-Rodríguez D","PLoS One","2016","2016/03/17","PMC4794235","","10.1371/journal.pone.0151163"
"26202052","Reduced skeletal muscle quantity and quality in patients with diabetic polyneuropathy assessed by magnetic resonance imaging","Moore CW, Allen MD, Kimpinski K, Doherty TJ, Rice CL.","Muscle Nerve. 2016 May;53(5):726-32. doi: 10.1002/mus.24779. Epub 2016 Jan 5.","Moore CW","Muscle Nerve","2016","2015/07/24","","","10.1002/mus.24779"
"25636500","M-mode ultrasound used to detect the onset of deep muscle activity","Dieterich AV, Pickard CM, Deshon LE, Strauss GR, Gibson W, Davey P, McKay J.","J Electromyogr Kinesiol. 2015 Apr;25(2):224-31. doi: 10.1016/j.jelekin.2014.12.006. Epub 2015 Jan 12.","Dieterich AV","J Electromyogr Kinesiol","2015","2015/02/01","","","10.1016/j.jelekin.2014.12.006"
"24671534","Finger-thumb coupling contributes to exaggerated thumb flexion in stroke survivors","Kamper DG, Fischer HC, Conrad MO, Towles JD, Rymer WZ, Triandafilou KM.","J Neurophysiol. 2014 Jun 15;111(12):2665-74. doi: 10.1152/jn.00413.2013. Epub 2014 Mar 26.","Kamper DG","J Neurophysiol","2014","2014/03/28","PMC6442660","","10.1152/jn.00413.2013"
"24281826","Effect of neuromuscular electrical stimulation intensity over the tibial nerve trunk on triceps surae muscle fatigue","Doix AC, Matkowski B, Martin A, Roeleveld K, Colson SS.","Eur J Appl Physiol. 2014 Feb;114(2):317-29. doi: 10.1007/s00421-013-2780-y. Epub 2013 Nov 27.","Doix AC","Eur J Appl Physiol","2014","2013/11/28","","","10.1007/s00421-013-2780-y"
"23605647","Spasticity, weakness, force variability, and sustained spontaneous motor unit discharges of resting spastic-paretic biceps brachii muscles in chronic stroke","Chang SH, Francisco GE, Zhou P, Rymer WZ, Li S.","Muscle Nerve. 2013 Jul;48(1):85-92. doi: 10.1002/mus.23699. Epub 2013 Apr 21.","Chang SH","Muscle Nerve","2013","2013/04/23","PMC3691331","NIHMS432348","10.1002/mus.23699"
"22965792","Neuromuscular fatigue and exercise capacity in fibromyalgia syndrome","Bachasson D, Guinot M, Wuyam B, Favre-Juvin A, Millet GY, Levy P, Verges S.","Arthritis Care Res (Hoboken). 2013 Mar;65(3):432-40. doi: 10.1002/acr.21845.","Bachasson D","Arthritis Care Res (Hoboken)","2013","2012/09/12","","","10.1002/acr.21845"
"22182851","Neurophysiological evaluation of segmental motor neuron function of the thoracic cord in chronic SCI","Frostell A, Mattsson P, Persson JK, Hedman B, Nordblom J, Lindenryd A, Trok K, Brundin L, Svensson M.","Spinal Cord. 2012 Apr;50(4):315-9. doi: 10.1038/sc.2011.155. Epub 2011 Dec 20.","Frostell A","Spinal Cord","2012","2011/12/21","","","10.1038/sc.2011.155"
"20167672","Central and peripheral contributions to neuromuscular fatigue induced by a 24-h treadmill run","Martin V, Kerhervé H, Messonnier LA, Banfi JC, Geyssant A, Bonnefoy R, Féasson L, Millet GY.","J Appl Physiol (1985). 2010 May;108(5):1224-33. doi: 10.1152/japplphysiol.01202.2009. Epub 2010 Feb 18.","Martin V","J Appl Physiol (1985)","2010","2010/02/20","","","10.1152/japplphysiol.01202.2009"
"19881006","Knee extension and flexion weakness in people with knee osteoarthritis: is antagonist cocontraction a factor?","Heiden TL, Lloyd DG, Ackland TR.","J Orthop Sports Phys Ther. 2009 Nov;39(11):807-15. doi: 10.2519/jospt.2009.3079.","Heiden TL","J Orthop Sports Phys Ther","2009","2009/11/03","","","10.2519/jospt.2009.3079"
"19342256","The use of EMG biofeedback for learning of selective activation of intra-muscular parts within the serratus anterior muscle: a novel approach for rehabilitation of scapular muscle imbalance","Holtermann A, Mork PJ, Andersen LL, Olsen HB, Søgaard K.","J Electromyogr Kinesiol. 2010 Apr;20(2):359-65. doi: 10.1016/j.jelekin.2009.02.009. Epub 2009 Apr 1.","Holtermann A","J Electromyogr Kinesiol","2010","2009/04/04","","","10.1016/j.jelekin.2009.02.009"
"16355074","Why does knee extensor muscles torque decrease after eccentric-type exercise?","Martin V, Millet GY, Lattier G, Perrod L.","J Sports Med Phys Fitness. 2005 Jun;45(2):143-51.","Martin V","J Sports Med Phys Fitness","2005","2005/12/16","","",""
"16195165","Muscle hypertrophy, strength development, and serum hormones during strength training in elderly women with fibromyalgia","Valkeinen H, Häkkinen K, Pakarinen A, Hannonen P, Häkkinen A, Airaksinen O, Niemitukia L, Kraemer WJ, Alén M.","Scand J Rheumatol. 2005 Jul-Aug;34(4):309-14. doi: 10.1080/03009740510018697.","Valkeinen H","Scand J Rheumatol","2005","2005/10/01","","","10.1080/03009740510018697"
"31773821","The effects of long-term muscle disuse on neuromuscular function in unilateral transtibial amputees","Sibley AR, Strike S, Moudy SC, Tillin NA.","Exp Physiol. 2020 Mar;105(3):408-418. doi: 10.1113/EP088087. Epub 2020 Feb 6.","Sibley AR","Exp Physiol","2020","2019/11/28","","","10.1113/EP088087"
"16779833","Relative contributions of muscle activation and muscle size to plantarflexor torque during rehabilitation after immobilization","Stevens JE, Pathare NC, Tillman SM, Scarborough MT, Gibbs CP, Shah P, Jayaraman A, Walter GA, Vandenborne K.","J Orthop Res. 2006 Aug;24(8):1729-36. doi: 10.1002/jor.20153.","Stevens JE","J Orthop Res","2006","2006/06/17","","","10.1002/jor.20153"
"33775526","Progressive hyperthermia elicits distinct responses in maximum and rapid torque production","Gordon RJFH, Tyler CJ, Castelli F, Diss CE, Tillin NA.","J Sci Med Sport. 2021 Aug;24(8):811-817. doi: 10.1016/j.jsams.2021.03.007. Epub 2021 Mar 19.","Gordon RJFH","J Sci Med Sport","2021","2021/03/29","","","10.1016/j.jsams.2021.03.007"
"33191855","Effect of environmental temperature change on the neuromechanical function of the quadriceps muscle","Spillane P, Bampouras TM.","Eur J Sport Sci. 2021 Oct;21(10):1394-1402. doi: 10.1080/17461391.2020.1851773. Epub 2020 Dec 14.","Spillane P","Eur J Sport Sci","2021","2020/11/16","","","10.1080/17461391.2020.1851773"
"32281749","Sex differences in muscle activity emerge during sustained low-intensity contractions but not during intermittent low-intensity contractions","Kavanagh JJ, Smith KA, Minahan CL.","Physiol Rep. 2020 Apr;8(7):e14398. doi: 10.14814/phy2.14398.","Kavanagh JJ","Physiol Rep","2020","2020/04/14","PMC7153036","","10.14814/phy2.14398"
"32078467","Joint and muscle-tendon coordination strategies during submaximal jumping","Wade L, Lichtwark GA, Farris DJ.","J Appl Physiol (1985). 2020 Mar 1;128(3):596-603. doi: 10.1152/japplphysiol.00293.2019. Epub 2020 Feb 20.","Wade L","J Appl Physiol (1985)","2020","2020/02/21","","","10.1152/japplphysiol.00293.2019"
"30096988","Acute effects of aerobic exercise performed with different volumes on strength performance and neuromuscular parameters","Ribeiro N, Ugrinowitsch C, Panissa VLG, Tricoli V.","Eur J Sport Sci. 2019 Apr;19(3):287-294. doi: 10.1080/17461391.2018.1500643. Epub 2018 Aug 10.","Ribeiro N","Eur J Sport Sci","2019","2018/08/12","","","10.1080/17461391.2018.1500643"
"29995227","Determining the potential sites of neural adaptation to cross-education: implications for the cross-education of muscle strength","Frazer AK, Pearce AJ, Howatson G, Thomas K, Goodall S, Kidgell DJ.","Eur J Appl Physiol. 2018 Sep;118(9):1751-1772. doi: 10.1007/s00421-018-3937-5. Epub 2018 Jul 11.","Frazer AK","Eur J Appl Physiol","2018","2018/07/12","","","10.1007/s00421-018-3937-5"
"27981782","Neuromuscular changes and the rapid adaptation following a bout of damaging eccentric exercise","Goodall S, Thomas K, Barwood M, Keane K, Gonzalez JT, St Clair Gibson A, Howatson G.","Acta Physiol (Oxf). 2017 Aug;220(4):486-500. doi: 10.1111/apha.12844. Epub 2017 Jan 5.","Goodall S","Acta Physiol (Oxf)","2017","2016/12/17","","","10.1111/apha.12844"
"26584478","Acute and delayed peripheral and central neuromuscular alterations induced by a short and intense downhill trail run","Giandolini M, Horvais N, Rossi J, Millet GY, Morin JB, Samozino P.","Scand J Med Sci Sports. 2016 Nov;26(11):1321-1333. doi: 10.1111/sms.12583. Epub 2015 Nov 19.","Giandolini M","Scand J Med Sci Sports","2016","2015/11/20","","","10.1111/sms.12583"
"27187101","Intensity-Dependent Contribution of Neuromuscular Fatigue after Constant-Load Cycling","Thomas K, Elmeua M, Howatson G, Goodall S.","Med Sci Sports Exerc. 2016 Sep;48(9):1751-60. doi: 10.1249/MSS.0000000000000950.","Thomas K","Med Sci Sports Exerc","2016","2016/05/18","","","10.1249/MSS.0000000000000950"
"26205982","Obesity-related differences in neuromuscular fatigue in adolescent girls","Garcia-Vicencio S, Martin V, Kluka V, Cardenoux C, Jegu AG, Fourot AV, Coudeyre E, Ratel S.","Eur J Appl Physiol. 2015 Nov;115(11):2421-32. doi: 10.1007/s00421-015-3222-9. Epub 2015 Jul 24.","Garcia-Vicencio S","Eur J Appl Physiol","2015","2015/07/25","","","10.1007/s00421-015-3222-9"
"25361617","Modulation of exercise-induced spinal loop properties in response to oxygen availability","Rupp T, Racinais S, Bringard A, Lapole T, Perrey S.","Eur J Appl Physiol. 2015 Mar;115(3):471-82. doi: 10.1007/s00421-014-3032-5. Epub 2014 Nov 1.","Rupp T","Eur J Appl Physiol","2015","2014/11/02","","","10.1007/s00421-014-3032-5"
"23349681","Muscle activity and inactivity periods during normal daily life","Tikkanen O, Haakana P, Pesola AJ, Häkkinen K, Rantalainen T, Havu M, Pullinen T, Finni T.","PLoS One. 2013;8(1):e52228. doi: 10.1371/journal.pone.0052228. Epub 2013 Jan 18.","Tikkanen O","PLoS One","2013","2013/01/26","PMC3548884","","10.1371/journal.pone.0052228"
"21753022","Diminished capacity to modulate motor activation patterns according to task contributes to thumb deficits following stroke","Triandafilou KM, Fischer HC, Towles JD, Kamper DG, Rymer WZ.","J Neurophysiol. 2011 Oct;106(4):1644-51. doi: 10.1152/jn.00936.2010. Epub 2011 Jul 13.","Triandafilou KM","J Neurophysiol","2011","2011/07/15","","","10.1152/jn.00936.2010"
"21716151","Cold water immersion recovery after simulated collision sport exercise","Pointon M, Duffield R.","Med Sci Sports Exerc. 2012 Feb;44(2):206-16. doi: 10.1249/MSS.0b013e31822b0977.","Pointon M","Med Sci Sports Exerc","2012","2011/07/01","","","10.1249/MSS.0b013e31822b0977"
"17054963","Lumbosacral orthoses reduce trunk muscle activity in a postural control task","Cholewicki J, Reeves NP, Everding VQ, Morrisette DC.","J Biomech. 2007;40(8):1731-6. doi: 10.1016/j.jbiomech.2006.08.005. Epub 2006 Oct 18.","Cholewicki J","J Biomech","2007","2006/10/24","","","10.1016/j.jbiomech.2006.08.005"
"11465745","Asymmetry of motor cortex excitability during a simple motor task: relationships with handedness and manual performance","Brouwer B, Sale MV, Nordstrom MA.","Exp Brain Res. 2001 Jun;138(4):467-76. doi: 10.1007/s002210100730.","Brouwer B","Exp Brain Res","2001","2001/07/24","","","10.1007/s002210100730"
"34787048","Lower knee flexion and hip extension rate of torque development in athletes with previous hamstring strain injury","Buhmann R, Trajano GS, Kerr GK, Shield AJ.","J Sports Sci. 2021 Nov 17:1-8. doi: 10.1080/02640414.2021.2003981. Online ahead of print.","Buhmann R","J Sports Sci","2021","2021/11/17","","","10.1080/02640414.2021.2003981"
"34147852","Different plantar flexors neuromuscular and mechanical characteristics depending on the preferred running form","Grosprêtre S, Gimenez P, Thouvenot A, Patoz A, Lussiana T, Mourot L.","J Electromyogr Kinesiol. 2021 Aug;59:102568. doi: 10.1016/j.jelekin.2021.102568. Epub 2021 Jun 16.","Grosprêtre S","J Electromyogr Kinesiol","2021","2021/06/20","","","10.1016/j.jelekin.2021.102568"
"32382067","Alterations to neuromuscular properties of skeletal muscle are temporally dissociated from the oxygen uptake slow component","Gajanand T, Conde Alonso S, Ramos JS, Antonietti JP, Borrani F.","Sci Rep. 2020 May 7;10(1):7728. doi: 10.1038/s41598-020-64395-5.","Gajanand T","Sci Rep","2020","2020/05/09","PMC7206089","","10.1038/s41598-020-64395-5"
