PMID,Title,Authors,Citation,First Author,Journal/Book,Publication Year,Create Date,PMCID,NIHMS ID,DOI
"20012984","The repeated bout effect of eccentric exercise is not associated with changes in voluntary activation","Kamandulis S, Skurvydas A, Brazaitis M, Skikas L, Duchateau J.","Eur J Appl Physiol. 2010 Apr;108(6):1065-74. doi: 10.1007/s00421-009-1219-y. Epub 2009 Dec 15.","Kamandulis S","Eur J Appl Physiol","2010","2009/12/17","","","10.1007/s00421-009-1219-y"
"25043506","Neuromuscular fatigue of the knee extensors during repeated maximal intensity intermittent-sprints on a cycle ergometer","Pearcey GE, Murphy JR, Behm DG, Hay DC, Power KE, Button DC.","Muscle Nerve. 2015 Apr;51(4):569-79. doi: 10.1002/mus.24342. Epub 2015 Feb 11.","Pearcey GE","Muscle Nerve","2015","2014/07/22","","","10.1002/mus.24342"
"33657985","Characteristics of the severely impaired hand in survivors of stroke with chronic impairments","Barry AJ, Kamper DG, Stoykov ME, Triandafilou K, Roth E.","Top Stroke Rehabil. 2021 Mar 3:1-11. doi: 10.1080/10749357.2021.1894660. Online ahead of print.","Barry AJ","Top Stroke Rehabil","2021","2021/03/04","","","10.1080/10749357.2021.1894660"
"33306589","Resistance Training to Failure vs. Not to Failure: Acute and Delayed Markers of Mechanical, Neuromuscular, and Biochemical Fatigue","González-Hernández JM, García-Ramos A, Colomer-Poveda D, Tvarijonaviciute A, Cerón J, Jiménez-Reyes P, Márquez G.","J Strength Cond Res. 2021 Apr 1;35(4):886-893. doi: 10.1519/JSC.0000000000003921.","González-Hernández JM","J Strength Cond Res","2021","2020/12/11","","","10.1519/JSC.0000000000003921"
"27997698","Specific joint angle dependency of voluntary activation during eccentric knee extensions","Doguet V, Rivière V, Guével A, Guilhem G, Chauvet L, Jubeau M.","Muscle Nerve. 2017 Oct;56(4):750-758. doi: 10.1002/mus.25515. Epub 2017 Apr 2.","Doguet V","Muscle Nerve","2017","2016/12/21","","","10.1002/mus.25515"
"19969181","Is the ability to maximally activate the dorsiflexors in men and women affected by indwelling electromyography needles?","Brown RE, Bruce SH, Jakobi JM.","Arch Phys Med Rehabil. 2009 Dec;90(12):2135-40. doi: 10.1016/j.apmr.2009.08.140.","Brown RE","Arch Phys Med Rehabil","2009","2009/12/09","","","10.1016/j.apmr.2009.08.140"
"31133969","Spasticity Assessment Based on the Maximum Isometrics Voluntary Contraction of Upper Limb Muscles in Post-stroke Hemiplegia","Wang H, Huang P, Li X, Samuel OW, Xiang Y, Li G.","Front Neurol. 2019 May 7;10:465. doi: 10.3389/fneur.2019.00465. eCollection 2019.","Wang H","Front Neurol","2019","2019/05/29","PMC6514055","","10.3389/fneur.2019.00465"
"22473785","Supraspinal fatigue after normoxic and hypoxic exercise in humans","Goodall S, González-Alonso J, Ali L, Ross EZ, Romer LM.","J Physiol. 2012 Jun 1;590(11):2767-82. doi: 10.1113/jphysiol.2012.228890. Epub 2012 Apr 2.","Goodall S","J Physiol","2012","2012/04/05","PMC3424730","","10.1113/jphysiol.2012.228890"
"27297772","Anticipation of magnetic and electrical stimuli does not impair maximal voluntary force production","Peyrard A, Sawh P, Fan S, Temesi J, Millet GY.","Neurosci Lett. 2016 Aug 15;628:128-31. doi: 10.1016/j.neulet.2016.06.024. Epub 2016 Jun 11.","Peyrard A","Neurosci Lett","2016","2016/06/15","","","10.1016/j.neulet.2016.06.024"
"30305044","The effect of whole body vibration training on quadriceps voluntary activation level of people with age-related muscle loss (sarcopenia): a randomized pilot study","Wei N, Ng GYF.","BMC Geriatr. 2018 Oct 11;18(1):240. doi: 10.1186/s12877-018-0923-z.","Wei N","BMC Geriatr","2018","2018/10/12","PMC6180370","","10.1186/s12877-018-0923-z"
"25943667","Augmented supraspinal fatigue following constant-load cycling in the heat","Goodall S, Charlton K, Hignett C, Prichard J, Barwood M, Howatson G, Thomas K.","Scand J Med Sci Sports. 2015 Jun;25 Suppl 1:164-72. doi: 10.1111/sms.12370.","Goodall S","Scand J Med Sci Sports","2015","2015/05/07","","","10.1111/sms.12370"
"29411127","Changes in central and peripheral neuromuscular fatigue indices after concentric versus eccentric contractions of the knee extensors","Souron R, Nosaka K, Jubeau M.","Eur J Appl Physiol. 2018 Apr;118(4):805-816. doi: 10.1007/s00421-018-3816-0. Epub 2018 Feb 6.","Souron R","Eur J Appl Physiol","2018","2018/02/08","","","10.1007/s00421-018-3816-0"
"17019297","Aerobic influence on neuromuscular function and tolerance during passive hyperthermia","Morrison SA, Sleivert GG, Cheung S.","Med Sci Sports Exerc. 2006 Oct;38(10):1754-61. doi: 10.1249/01.mss.0000230120.83641.98.","Morrison SA","Med Sci Sports Exerc","2006","2006/10/05","","","10.1249/01.mss.0000230120.83641.98"
"19229967","Effect of age on muscle activation and twitch properties during static and dynamic actions","Wilder MR, Cannon J.","Muscle Nerve. 2009 May;39(5):683-91. doi: 10.1002/mus.21233.","Wilder MR","Muscle Nerve","2009","2009/02/21","","","10.1002/mus.21233"
"16924484","Reflex gain of muscle spindle pathways during fatigue","Biro A, Griffin L, Cafarelli E.","Exp Brain Res. 2007 Feb;177(2):157-66. doi: 10.1007/s00221-006-0656-7. Epub 2006 Aug 22.","Biro A","Exp Brain Res","2007","2006/08/23","","","10.1007/s00221-006-0656-7"
"28432420","Sex differences in neuromuscular function after repeated eccentric contractions of the knee extensor muscles","Lee A, Baxter J, Eischer C, Gage M, Hunter S, Yoon T.","Eur J Appl Physiol. 2017 Jun;117(6):1119-1130. doi: 10.1007/s00421-017-3599-8. Epub 2017 Apr 21.","Lee A","Eur J Appl Physiol","2017","2017/04/23","","","10.1007/s00421-017-3599-8"
"16978456","Synergistic muscle activation during maximum voluntary activation in children with or without spastic CP","Lin JP.","Dev Med Child Neurol. 2006 Oct;48(10):788. doi: 10.1017/S001216220600171X.","Lin JP","Dev Med Child Neurol","2006","2006/09/19","","","10.1017/S001216220600171X"
"20813979","Effect of graded hypoxia on supraspinal contributions to fatigue with unilateral knee-extensor contractions","Goodall S, Ross EZ, Romer LM.","J Appl Physiol (1985). 2010 Dec;109(6):1842-51. doi: 10.1152/japplphysiol.00458.2010. Epub 2010 Sep 2.","Goodall S","J Appl Physiol (1985)","2010","2010/09/04","","","10.1152/japplphysiol.00458.2010"
"22139408","Quadriceps femoris muscle function prior and after total knee arthroplasty in women with knee osteoarthritis","Vahtrik D, Gapeyeva H, Aibast H, Ereline J, Kums T, Haviko T, Märtson A, Schneider G, Pääsuke M.","Knee Surg Sports Traumatol Arthrosc. 2012 Oct;20(10):2017-25. doi: 10.1007/s00167-011-1808-2. Epub 2011 Dec 3.","Vahtrik D","Knee Surg Sports Traumatol Arthrosc","2012","2011/12/06","","","10.1007/s00167-011-1808-2"
"29738677","Greater fatigability in knee-flexors vs. knee-extensors after a standardized fatiguing protocol","Coratella G, Grosprêtre S, Gimenez P, Mourot L.","Eur J Sport Sci. 2018 Sep;18(8):1110-1118. doi: 10.1080/17461391.2018.1469674. Epub 2018 May 8.","Coratella G","Eur J Sport Sci","2018","2018/05/09","","","10.1080/17461391.2018.1469674"
"16424068","Exercise-induced abdominal muscle fatigue in healthy humans","Taylor BJ, How SC, Romer LM.","J Appl Physiol (1985). 2006 May;100(5):1554-62. doi: 10.1152/japplphysiol.01389.2005. Epub 2006 Jan 19.","Taylor BJ","J Appl Physiol (1985)","2006","2006/01/21","","","10.1152/japplphysiol.01389.2005"
"24835195","Shortening-induced torque depression in old men: implications for age-related power loss","Power GA, Makrakos DP, Stevens DE, Herzog W, Rice CL, Vandervoort AA.","Exp Gerontol. 2014 Sep;57:75-80. doi: 10.1016/j.exger.2014.05.004. Epub 2014 May 14.","Power GA","Exp Gerontol","2014","2014/05/20","","","10.1016/j.exger.2014.05.004"
"32869360","Task failure during sustained low-intensity contraction is not associated with a critical amount of central fatigue","Souron R, Voirin AC, Kennouche D, Espeit L, Millet GY, Rupp T, Lapole T.","Scand J Med Sci Sports. 2020 Dec;30(12):2329-2341. doi: 10.1111/sms.13815. Epub 2020 Sep 13.","Souron R","Scand J Med Sci Sports","2020","2020/09/02","","","10.1111/sms.13815"
"15183432","Neuromuscular quadriceps dysfunction prior to osteoarthritis of the knee","Becker R, Berth A, Nehring M, Awiszus F.","J Orthop Res. 2004 Jul;22(4):768-73. doi: 10.1016/j.orthres.2003.11.004.","Becker R","J Orthop Res","2004","2004/06/09","","","10.1016/j.orthres.2003.11.004"
"19350263","Assessment of plantar flexors activation capacity: nerve versus muscle stimulation by single versus double pulse","Scaglioni G, Martin A.","Eur J Appl Physiol. 2009 Jul;106(4):563-72. doi: 10.1007/s00421-009-1049-y. Epub 2009 Apr 7.","Scaglioni G","Eur J Appl Physiol","2009","2009/04/08","","","10.1007/s00421-009-1049-y"
"17197313","Strength and voluntary activation of quadriceps femoris muscle in total knee arthroplasty with midvastus and subvastus approaches","Berth A, Urbach D, Neumann W, Awiszus F.","J Arthroplasty. 2007 Jan;22(1):83-8. doi: 10.1016/j.arth.2006.02.161.","Berth A","J Arthroplasty","2007","2007/01/02","","","10.1016/j.arth.2006.02.161"
"16320169","Central and peripheral fatigue of the knee extensor muscles induced by electromyostimulation","Zory R, Boërio D, Jubeau M, Maffiuletti NA.","Int J Sports Med. 2005 Dec;26(10):847-53. doi: 10.1055/s-2005-837459.","Zory R","Int J Sports Med","2005","2005/12/02","","","10.1055/s-2005-837459"
"11509498","Hyperthermia and central fatigue during prolonged exercise in humans","Nybo L, Nielsen B.","J Appl Physiol (1985). 2001 Sep;91(3):1055-60. doi: 10.1152/jappl.2001.91.3.1055.","Nybo L","J Appl Physiol (1985)","2001","2001/08/18","","","10.1152/jappl.2001.91.3.1055"
"12665984","Perceived exertion is elevated in old age during an isometric fatigue task","Allman BL, Rice CL.","Eur J Appl Physiol. 2003 Apr;89(2):191-7. doi: 10.1007/s00421-002-0780-4. Epub 2003 Feb 28.","Allman BL","Eur J Appl Physiol","2003","2003/04/01","","","10.1007/s00421-002-0780-4"
"30015134","Global electromyographic signal characteristics depend on maximal isometric contraction method in the knee extensors","Tomko PM, Colquhoun RJ, Magrini MA, Muddle TWD, Jenkins NDM.","J Electromyogr Kinesiol. 2018 Oct;42:111-116. doi: 10.1016/j.jelekin.2018.07.002. Epub 2018 Jul 10.","Tomko PM","J Electromyogr Kinesiol","2018","2018/07/18","","","10.1016/j.jelekin.2018.07.002"
"11394588","Knee muscle isometric strength, voluntary activation and antagonist co-contraction in the first six months after stroke","Newham DJ, Hsiao SF.","Disabil Rehabil. 2001 Jun 15;23(9):379-86. doi: 10.1080/0963828001006656.","Newham DJ","Disabil Rehabil","2001","2001/06/08","","","10.1080/0963828001006656"
"31376801","Acute effects of bi-hemispheric transcranial direct current stimulation on the neuromuscular function of patients with chronic stroke: A randomized controlled study","Geiger M, Roche N, Vlachos E, Cattagni T, Zory R.","Clin Biomech (Bristol, Avon). 2019 Dec;70:1-7. doi: 10.1016/j.clinbiomech.2019.07.022. Epub 2019 Jul 24.","Geiger M","Clin Biomech (Bristol, Avon)","2019","2019/08/04","","","10.1016/j.clinbiomech.2019.07.022"
"19670468","The interpolated twitch and the force capacity of muscle","Enoka RM.","J Appl Physiol (1985). 2009 Jul;107(1):359; discussion 367-8. doi: 10.1152/japplphysiol.00362.2009.","Enoka RM","J Appl Physiol (1985)","2009","2009/08/12","","","10.1152/japplphysiol.00362.2009"
"24368553","Effects of endurance training on the maximal voluntary activation level of the knee extensor muscles","Zghal F, Martin V, Thorkani A, Arnal PJ, Tabka Z, Cottin F.","Eur J Appl Physiol. 2014 Apr;114(4):683-93. doi: 10.1007/s00421-013-2793-6. Epub 2013 Dec 25.","Zghal F","Eur J Appl Physiol","2014","2013/12/26","","","10.1007/s00421-013-2793-6"
"26726950","Voluntary activation of quadriceps femoris in patients with unilateral anterior cruciate ligament rupture within 6 months of injury: A cross-sectional observational study","Trees A, Dixon J, Howe TE.","Man Ther. 2016 Apr;22:153-7. doi: 10.1016/j.math.2015.11.007. Epub 2015 Dec 11.","Trees A","Man Ther","2016","2016/01/05","","","10.1016/j.math.2015.11.007"
"29316518","Muscle size-strength relationship including ultrasonographic echo intensity and voluntary activation level of a muscle group","Akagi R, Suzuki M, Kawaguchi E, Miyamoto N, Yamada Y, Ema R.","Arch Gerontol Geriatr. 2018 Mar-Apr;75:185-190. doi: 10.1016/j.archger.2017.12.012. Epub 2017 Dec 27.","Akagi R","Arch Gerontol Geriatr","2018","2018/01/10","","","10.1016/j.archger.2017.12.012"
"23302752","The reliability of the interpolated twitch technique during submaximal and maximal isometric muscle actions","Cooper MA, Herda TJ, Walter-Herda AA, Costa PB, Ryan ED, Cramer JT.","J Strength Cond Res. 2013 Oct;27(10):2909-13. doi: 10.1519/JSC.0b013e31828159ac.","Cooper MA","J Strength Cond Res","2013","2013/01/11","","","10.1519/JSC.0b013e31828159ac"
"23760468","Does central fatigue explain reduced cycling after complete sleep deprivation?","Temesi J, Arnal PJ, Davranche K, Bonnefoy R, Levy P, Verges S, Millet GY.","Med Sci Sports Exerc. 2013 Dec;45(12):2243-53. doi: 10.1249/MSS.0b013e31829ce379.","Temesi J","Med Sci Sports Exerc","2013","2013/06/14","","","10.1249/MSS.0b013e31829ce379"
"27287015","Original Research: Central and peripheral quadriceps fatigue in young and middle-aged untrained and endurance-trained men: A comparative study","Bachasson D, Decorte N, Wuyam B, Millet GY, Verges S.","Exp Biol Med (Maywood). 2016 Oct;241(16):1844-52. doi: 10.1177/1535370216654225. Epub 2016 Jun 10.","Bachasson D","Exp Biol Med (Maywood)","2016","2016/06/12","PMC5027946","","10.1177/1535370216654225"
"26655823","Is the notion of central fatigue based on a solid foundation?","Contessa P, Puleo A, De Luca CJ.","J Neurophysiol. 2016 Feb 1;115(2):967-77. doi: 10.1152/jn.00889.2015. Epub 2015 Dec 9.","Contessa P","J Neurophysiol","2016","2015/12/15","PMC4888967","","10.1152/jn.00889.2015"
"15705734","Aging does not affect voluntary activation of the ankle dorsiflexors during isometric, concentric, and eccentric contractions","Klass M, Baudry S, Duchateau J.","J Appl Physiol (1985). 2005 Jul;99(1):31-8. doi: 10.1152/japplphysiol.01426.2004. Epub 2005 Feb 10.","Klass M","J Appl Physiol (1985)","2005","2005/02/12","","","10.1152/japplphysiol.01426.2004"
"15266632","Prediction of voluntary activation, strength and endurance of elbow flexors in postpolio patients","Allen GM, Middleton J, Katrak PH, Lord SR, Gandevia SC.","Muscle Nerve. 2004 Aug;30(2):172-81. doi: 10.1002/mus.20094.","Allen GM","Muscle Nerve","2004","2004/07/22","","","10.1002/mus.20094"
"15866968","Early quadriceps strength loss after total knee arthroplasty. The contributions of muscle atrophy and failure of voluntary muscle activation","Mizner RL, Petterson SC, Stevens JE, Vandenborne K, Snyder-Mackler L.","J Bone Joint Surg Am. 2005 May;87(5):1047-53. doi: 10.2106/JBJS.D.01992.","Mizner RL","J Bone Joint Surg Am","2005","2005/05/04","PMC1167681","NIHMS2113","10.2106/JBJS.D.01992"
"24163095","Perception of effort changes following an isometric fatiguing exercise of elbow flexors","Lampropoulou SI, Nowicky AV.","Motor Control. 2014 Apr;18(2):146-64. doi: 10.1123/mc.2013-0010. Epub 2013 Oct 25.","Lampropoulou SI","Motor Control","2014","2013/10/29","","","10.1123/mc.2013-0010"
"15015001","Passive hyperthermia reduces voluntary activation and isometric force production","Morrison S, Sleivert GG, Cheung SS.","Eur J Appl Physiol. 2004 May;91(5-6):729-36. doi: 10.1007/s00421-004-1063-z. Epub 2004 Mar 11.","Morrison S","Eur J Appl Physiol","2004","2004/03/12","","","10.1007/s00421-004-1063-z"
"32116731","Six Sessions of Sprint-Interval Training Did Not Improve Endurance and Neuromuscular Performance in Untrained Men","Bertschinger R, Giboin LS, Gruber M.","Front Physiol. 2020 Jan 28;10:1578. doi: 10.3389/fphys.2019.01578. eCollection 2019.","Bertschinger R","Front Physiol","2020","2020/03/03","PMC7025594","","10.3389/fphys.2019.01578"
"15962274","Accuracy of predicting maximal quadriceps force from submaximal effort contractions after anterior cruciate ligament injury","Farquhar SJ, Chmielewski TL, Snyder-Mackler L.","Muscle Nerve. 2005 Oct;32(4):500-5. doi: 10.1002/mus.20366.","Farquhar SJ","Muscle Nerve","2005","2005/06/18","","","10.1002/mus.20366"
"26173034","Reproducibility of electromyographic and mechanical parameters of the triceps surae during submaximal and maximal plantar flexions","Stutzig N, Siebert T.","Muscle Nerve. 2016 Mar;53(3):464-70. doi: 10.1002/mus.24767. Epub 2016 Jan 5.","Stutzig N","Muscle Nerve","2016","2015/07/15","","","10.1002/mus.24767"
"27012311","Neuromuscular fatigue and time motion analysis during a table tennis competition","LE Mansec Y, Seve C, Jubeau M.","J Sports Med Phys Fitness. 2017 Apr;57(4):353-361. doi: 10.23736/S0022-4707.16.06129-6. Epub 2016 Mar 24.","LE Mansec Y","J Sports Med Phys Fitness","2017","2016/03/26","","","10.23736/S0022-4707.16.06129-6"
"26272315","Locomotor muscle fatigue is not critically regulated after prior upper body exercise","Johnson MA, Sharpe GR, Williams NC, Hannah R.","J Appl Physiol (1985). 2015 Oct 1;119(7):840-50. doi: 10.1152/japplphysiol.00072.2015. Epub 2015 Aug 13.","Johnson MA","J Appl Physiol (1985)","2015","2015/08/15","","","10.1152/japplphysiol.00072.2015"
"30844334","Menstrual cycle-associated modulations in neuromuscular function and fatigability of the knee extensors in eumenorrheic women","Ansdell P, Brownstein CG, Škarabot J, Hicks KM, Simoes DCM, Thomas K, Howatson G, Hunter SK, Goodall S.","J Appl Physiol (1985). 2019 Jun 1;126(6):1701-1712. doi: 10.1152/japplphysiol.01041.2018. Epub 2019 Mar 7.","Ansdell P","J Appl Physiol (1985)","2019","2019/03/08","","","10.1152/japplphysiol.01041.2018"
"18370947","Hip orthosis powered by pneumatic artificial muscle: voluntary activation in absence of myoelectrical signal","do Nascimento BG, Vimieiro CB, Nagem DA, Pinotti M.","Artif Organs. 2008 Apr;32(4):317-22. doi: 10.1111/j.1525-1594.2008.00549.x.","do Nascimento BG","Artif Organs","2008","2008/03/29","","","10.1111/j.1525-1594.2008.00549.x"
"27976404","Voluntary activation and cerebral blood flow: better measurement leads to less argument","Gandevia S.","J Physiol. 2016 Dec 15;594(24):7483-7484. doi: 10.1113/JP273015.","Gandevia S","J Physiol","2016","2016/12/16","PMC5157071","","10.1113/JP273015"
"19640732","Neuromuscular fatigue following low-intensity dynamic exercise with externally applied vascular restriction","Karabulut M, Cramer JT, Abe T, Sato Y, Bemben MG.","J Electromyogr Kinesiol. 2010 Jun;20(3):440-7. doi: 10.1016/j.jelekin.2009.06.005. Epub 2009 Jul 28.","Karabulut M","J Electromyogr Kinesiol","2010","2009/07/31","","","10.1016/j.jelekin.2009.06.005"
"31827352","Effect of the Anode Placement on the Antagonist Muscles Recruitment: Implication for the Interpolated Twitch Technique Outcome","Piponnier E, Thorkani A, Zghal F, Cottin F, Martin V.","J Sports Sci Med. 2019 Nov 19;18(4):674-679. eCollection 2019 Dec.","Piponnier E","J Sports Sci Med","2019","2019/12/13","PMC6873139","",""
"12015339","Plantar flexor activation capacity and H reflex in older adults: adaptations to strength training","Scaglioni G, Ferri A, Minetti AE, Martin A, Van Hoecke J, Capodaglio P, Sartorio A, Narici MV.","J Appl Physiol (1985). 2002 Jun;92(6):2292-302. doi: 10.1152/japplphysiol.00367.2001.","Scaglioni G","J Appl Physiol (1985)","2002","2002/05/17","","","10.1152/japplphysiol.00367.2001"
"12677313","The effect of a contralateral contraction on maximal voluntary activation and central fatigue in elbow flexor muscles","Todd G, Petersen NT, Taylor JL, Gandevia SC.","Exp Brain Res. 2003 Jun;150(3):308-13. doi: 10.1007/s00221-003-1379-7. Epub 2003 Apr 3.","Todd G","Exp Brain Res","2003","2003/04/05","","","10.1007/s00221-003-1379-7"
"31704592","Psychoactive medications in chronic obstructive pulmonary disease patients: From prevalence to effects on motor command and strength","Cabibel V, Alexandre F, Oliver N, Varray A, Héraud N.","Respir Med. 2019 Nov;159:105805. doi: 10.1016/j.rmed.2019.105805. Epub 2019 Oct 25.","Cabibel V","Respir Med","2019","2019/11/10","","","10.1016/j.rmed.2019.105805"
"34202491","Neuromuscular Adaptations after an Altitude Training Camp in Elite Judo Athletes","Tomazin K, Almeida F, Stirn I, Padial P, Bonitch-Góngora J, Morales-Artacho AJ, Strojnik V, Feriche B.","Int J Environ Res Public Health. 2021 Jun 24;18(13):6777. doi: 10.3390/ijerph18136777.","Tomazin K","Int J Environ Res Public Health","2021","2021/07/02","PMC8296934","","10.3390/ijerph18136777"
"25716541","Voluntary activation of trunk extensors appears normal in young adults who have recovered from low back pain","Chiou SY, Jeevathol A, Odedra A, Strutton PH.","Eur J Pain. 2015 Nov;19(10):1506-15. doi: 10.1002/ejp.684. Epub 2015 Feb 25.","Chiou SY","Eur J Pain","2015","2015/02/27","","","10.1002/ejp.684"
"21319165","Short-term unilateral resistance training affects the agonist-antagonist but not the force-agonist activation relationship","Tillin NA, Pain MT, Folland JP.","Muscle Nerve. 2011 Mar;43(3):375-84. doi: 10.1002/mus.21885.","Tillin NA","Muscle Nerve","2011","2011/02/15","","","10.1002/mus.21885"
"21307618","The effect of intense interval cycle-training on unloading-induced dysfunction and atrophy in the human calf muscle","Hotta N, Ishida K, Sato K, Koike T, Katayama K, Akima H.","J Physiol Anthropol. 2011;30(1):29-35. doi: 10.2114/jpa2.30.29.","Hotta N","J Physiol Anthropol","2011","2011/02/11","","","10.2114/jpa2.30.29"
"15574801","Interhemispheric coupling of corticospinal excitability is suppressed during voluntary muscle activation","Pearce SL, Thompson PD, Nordstrom MA.","J Neurophysiol. 2005 Apr;93(4):2174-82. doi: 10.1152/jn.00449.2004. Epub 2004 Dec 1.","Pearce SL","J Neurophysiol","2005","2004/12/03","","","10.1152/jn.00449.2004"
"11944103","EMG activity and voluntary activation during knee-extensor concentric torque generation","Babault N, Pousson M, Michaut A, Ballay Y, Hoecke JV.","Eur J Appl Physiol. 2002 Apr;86(6):541-7. doi: 10.1007/s00421-002-0579-3. Epub 2002 Mar 7.","Babault N","Eur J Appl Physiol","2002","2002/04/11","","","10.1007/s00421-002-0579-3"
"21188412","Neuromuscular function following prolonged intense self-paced exercise in hot climatic conditions","Périard JD, Cramer MN, Chapman PG, Caillaud C, Thompson MW.","Eur J Appl Physiol. 2011 Aug;111(8):1561-9. doi: 10.1007/s00421-010-1781-3. Epub 2010 Dec 28.","Périard JD","Eur J Appl Physiol","2011","2010/12/29","","","10.1007/s00421-010-1781-3"
"18687979","Recovery from supraspinal fatigue is slowed in old adults after fatiguing maximal isometric contractions","Hunter SK, Todd G, Butler JE, Gandevia SC, Taylor JL.","J Appl Physiol (1985). 2008 Oct;105(4):1199-209. doi: 10.1152/japplphysiol.01246.2007. Epub 2008 Aug 7.","Hunter SK","J Appl Physiol (1985)","2008","2008/08/09","","","10.1152/japplphysiol.01246.2007"
"22952305","Does neuromuscular electrical stimulation enhance the effectiveness of an exercise programme in subjects with knee osteoarthritis? A randomized controlled trial","Elboim-Gabyzon M, Rozen N, Laufer Y.","Clin Rehabil. 2013 Mar;27(3):246-57. doi: 10.1177/0269215512456388. Epub 2012 Sep 5.","Elboim-Gabyzon M","Clin Rehabil","2013","2012/09/07","","","10.1177/0269215512456388"
"19401949","Manipulation of rest period length induces different causes of fatigue in vertical jumping","Pereira G, Morse C, Ugrinowitsch C, Rodacki A, Kokubun E, Fowler N.","Int J Sports Med. 2009 May;30(5):325-30. doi: 10.1055/s-0029-1202260. Epub 2009 Apr 28.","Pereira G","Int J Sports Med","2009","2009/04/30","","","10.1055/s-0029-1202260"
"27834612","The Effectiveness of Neuromuscular Electrical Stimulation in Improving Voluntary Activation of the Quadriceps: A Critically Appraised Topic","Bremner CB, Holcomb WR, Brown CD, Perreault ME.","J Sport Rehabil. 2017 Jul;26(4):316-323. doi: 10.1123/jsr.2015-0100. Epub 2016 Nov 11.","Bremner CB","J Sport Rehabil","2017","2016/11/12","","","10.1123/jsr.2015-0100"
"19670475","The interpolated twitch technique may be valid and reliable but limited","Behm DG.","J Appl Physiol (1985). 2009 Jul;107(1):362; discussion 367-8. doi: 10.1152/japplphysiol.00362.2009.","Behm DG","J Appl Physiol (1985)","2009","2009/08/12","","","10.1152/japplphysiol.00362.2009"
"15258127","Assessment of low-frequency fatigue with two methods of electrical stimulation","Martin V, Millet GY, Martin A, Deley G, Lattier G.","J Appl Physiol (1985). 2004 Nov;97(5):1923-9. doi: 10.1152/japplphysiol.00376.2004. Epub 2004 Jul 16.","Martin V","J Appl Physiol (1985)","2004","2004/07/20","","","10.1152/japplphysiol.00376.2004"
"19150854","Estimation of critical torque using intermittent isometric maximal voluntary contractions of the quadriceps in humans","Burnley M.","J Appl Physiol (1985). 2009 Mar;106(3):975-83. doi: 10.1152/japplphysiol.91474.2008. Epub 2009 Jan 15.","Burnley M","J Appl Physiol (1985)","2009","2009/01/20","","","10.1152/japplphysiol.91474.2008"
"19670480","Twitch interpolation a valid measure with misinterpreted meaning","Gandevia SC.","J Appl Physiol (1985). 2009 Jul;107(1):363-4; discussion 367-8. doi: 10.1152/japplphysiol.00362.2009.","Gandevia SC","J Appl Physiol (1985)","2009","2009/08/12","","","10.1152/japplphysiol.00362.2009"
"19670477","Twitch interpolation a valid measure with misinterpreted meaning","Jakobi JM.","J Appl Physiol (1985). 2009 Jul;107(1):362-3; discussion 367-8. doi: 10.1152/japplphysiol.00362.2009.","Jakobi JM","J Appl Physiol (1985)","2009","2009/08/12","","","10.1152/japplphysiol.00362.2009"
"19670478","Twitch interpolation a valid measure with misinterpreted meaning","Binder-Macleod SA, Perumal R, Chou LW, Kesar T, Snyder-Mackler L.","J Appl Physiol (1985). 2009 Jul;107(1):363; discussion 367-8. doi: 10.1152/japplphysiol.00362.2009.","Binder-Macleod SA","J Appl Physiol (1985)","2009","2009/08/12","","","10.1152/japplphysiol.00362.2009"
